{
  "$schema": "http://json-schema.org/draft-07/schema#",
  "title": "Ori Dual-TPR Findings Envelope V1",
  "description": "Structural schema for the dual-source TPR findings envelope. Enforcement is parser-layer only: parse-codex.py and parse-gemini.py validate reviewer output against this schema via jsonschema.validate(), then apply the code-level invariants in envelope_invariants.py (regex patterns, length limits, conditional requirements). Codex is NOT invoked with --output-schema — BUG-08-003 phase 2 removed that flag from dual-invoke.sh because OpenAI's Structured Outputs strict mode rejected several constraints in the original schema (see the commit message for a5a2753f). The schema remains OpenAI-strict-subset compatible (no if/then/pattern/maxLength/minimum/format) in case a future phase re-enables API-level enforcement, but the current enforcement model is symmetric: both codex and gemini are validated ONLY at the parser layer. See BUG-08-003 and TPR-04-003-codex for the rationale.",
  "type": "object",
  "required": ["schema_version", "status", "reviewer", "skill", "scope_actually_reviewed", "findings", "no_findings"],
  "properties": {
    "schema_version": {
      "type": "string",
      "const": "1.0"
    },
    "status": {
      "type": "string",
      "enum": ["complete", "failed_partial"],
      "description": "complete = clean termination; failed_partial = reviewer ran but did not finish all analysis. Missing field or any other value is treated as 'failed' by the orchestrator."
    },
    "reviewer": {
      "type": "string",
      "enum": ["codex", "gemini"]
    },
    "skill": {
      "type": "string",
      "enum": ["tpr-review", "review-work", "review-plan", "tp-help", "custom"]
    },
    "scope_actually_reviewed": {
      "type": "object",
      "required": ["expanded_beyond_packet", "files_read", "rules_consulted"],
      "properties": {
        "git_range": {"type": ["string", "null"]},
        "files_read": {"type": "array", "items": {"type": "string"}},
        "rules_consulted": {"type": "array", "items": {"type": "string"}},
        "specs_consulted": {"type": "array", "items": {"type": "string"}},
        "plans_consulted": {"type": "array", "items": {"type": "string"}},
        "expanded_beyond_packet": {
          "type": "boolean",
          "description": "REQUIRED. The reviewer must explicitly state whether it expanded its investigation beyond the orchestrator's starting packet."
        },
        "expansion_reason": {
          "type": "string",
          "description": "Required (and must be non-empty) when expanded_beyond_packet is true. One sentence explaining what additional surface was explored and why. Code-level invariant enforced in envelope_invariants.py."
        }
      }
    },
    "findings": {
      "type": "array",
      "items": {
        "type": "object",
        "required": ["ordinal", "severity", "location", "title", "evidence", "impact", "basis"],
        "properties": {
          "ordinal": {
            "type": "integer",
            "description": "1-indexed insertion order. Code-level invariant: ordinal >= 1 enforced in envelope_invariants.py."
          },
          "severity": {"type": "string", "enum": ["high", "medium", "low", "informational"], "description": "high/medium/low = actionable findings that must be fixed. informational = non-actionable observation (reviewer has no real issues but wants to note something). Informational findings do not block the TPR loop's clean-pass check."},
          "location": {
            "type": "string",
            "description": "Repo-relative path:line. No absolute paths, no leading ./, no line ranges. Dotfiles like .gitignore:3 ARE allowed; only the leading two-character ./ prefix is rejected. Code-level invariant: regex ^(?!/)(?!\\./)[a-zA-Z0-9_./-]+:[0-9]+$ enforced in envelope_invariants.py."
          },
          "title": {
            "type": "string",
            "description": "Imperative voice, sentence case, no markdown, no trailing punctuation. Code-level invariant: maxLength 200 enforced in envelope_invariants.py. Style is enforced by prompt template."
          },
          "evidence": {"type": "string"},
          "impact": {"type": "string"},
          "required_plan_update": {"type": "string"},
          "layer": {
            "type": "string",
            "enum": ["committed", "staged", "unstaged"]
          },
          "basis": {
            "type": "string",
            "enum": ["fresh_verification", "direct_file_inspection", "git_history", "inference"]
          },
          "confidence": {"type": "string", "enum": ["high", "medium", "low"]},
          "citations": {
            "type": "array",
            "items": {
              "type": "object",
              "required": ["url"],
              "properties": {
                "url": {
                  "type": "string",
                  "description": "Source URL. Code-level invariant: format=uri enforced in envelope_invariants.py."
                },
                "description": {"type": "string"}
              }
            },
            "description": "Source URLs (gemini's google_web_search results, codex prior-art references, etc.). Tool-agnostic name (renamed from search_citations per Codex Round 1 feedback)."
          }
        }
      }
    },
    "verification": {
      "type": "object",
      "properties": {
        "tests_rerun": {"type": "array", "items": {"type": "string"}},
        "diagnostics_run": {"type": "array", "items": {"type": "string"}},
        "verification_gaps": {"type": "array", "items": {"type": "string"}}
      }
    },
    "no_findings": {
      "type": "boolean",
      "description": "Explicit 'reviewed cleanly with zero actionable findings' flag. Without this, an empty findings array could mean 'crashed before finding anything'. Code-level invariant: when no_findings is true, findings array must be empty; enforced in envelope_invariants.py."
    }
  }
}
