{
  "schema_version": "1.0",
  "status": "complete",
  "reviewer": "codex",
  "skill": "review-work",
  "scope_actually_reviewed": {
    "git_range": "HEAD~1..HEAD",
    "files_read": [
      "plans/dual-tpr-gemini/section-01-contracts-foundation.md",
      ".claude/skills/dual-tpr/findings-schema.json"
    ],
    "rules_consulted": [
      ".claude/rules/impl-hygiene.md"
    ],
    "specs_consulted": [],
    "plans_consulted": [
      "plans/dual-tpr-gemini/00-overview.md"
    ],
    "expanded_beyond_packet": false
  },
  "findings": [],
  "verification": {
    "tests_rerun": [],
    "diagnostics_run": [],
    "verification_gaps": []
  },
  "no_findings": true
}
